{
  "name": "Buttermilk Pancakes with Swaps",
  "ingredients": [
    { "item": "Flour", "quantity": { "amount": 240, "unit": "g" } },
    { "item": "Buttermilk", "quantity": { "amount": 355, "unit": "ml" } },
    "2 eggs"
  ],
  "instructions": [
    "Whisk dry ingredients together",
    "Fold in buttermilk and eggs",
    "Cook pancakes on a griddle"
  ],
  "substitutions": [
    {
      "ingredient": "Buttermilk",
      "notes": "Maintain acidity for lift",
      "alternatives": [
        { "name": "Milk with lemon juice", "ratio": "1:1", "notes": "Rest 10 minutes" },
        { "name": "Yogurt plus water", "ratio": "1:1", "dietary": ["vegetarian"] }
      ]
    },
    {
      "ingredient": "Butter",
      "critical": true,
      "alternatives": [
        { "name": "Neutral oil", "ratio": "1:1", "impact": "Slightly less flavor" },
        { "name": "Coconut oil", "ratio": "1:1", "notes": "Adds coconut aroma" }
      ]
    }
  ]
}
