{
  "$schema": "http://soustack.org/schema/v0.3.0/profiles/scalable",
  "id": "scaling-modes",
  "name": "Scaling Modes Sampler",
  "ingredients": [
    { "id": "flour", "item": "Flour", "quantity": { "amount": 500, "unit": "g" }, "scaling": { "type": "linear" } },
    { "item": "Eggs", "quantity": { "amount": 3, "unit": "each" }, "scaling": { "type": "discrete", "roundTo": 1 } },
    { "item": "Salt", "quantity": { "amount": 10, "unit": "g" }, "scaling": { "type": "fixed" } },
    { "item": "Chocolate Chips", "quantity": { "amount": 150, "unit": "g" }, "scaling": { "type": "proportional", "factor": 0.5 } },
    { "id": "starter", "item": "Sourdough starter", "quantity": { "amount": 100, "unit": "g" }, "scaling": { "type": "bakers_percentage", "referenceId": "flour", "factor": 0.2 } }
  ],
  "instructions": [
    { "text": "Mix dry ingredients" },
    { "text": "Fold in chocolate chips" },
    { "text": "Rest dough" }
  ],
  "yield": { "amount": 1, "unit": "batch" }
}
